<?xml version="1.0" encoding="utf-8"?>
<config xmlns="http://www.atb-bremen.de"
        xmlns:xsi="http://www.w3.org/2001/XMLSchema-instance"
        xsi:schemaLocation="http://www.atb-bremen.de services-config.xsd">

    <services>
        <service id="AmIMonitoring">
            <host>localhost</host>
            <location>http://localhost:19001</location>
            <name>AmIMonitoringService</name>
            <server>org.eclipse.opensmartclide.context.services.AmIMonitoringService</server>
            <proxy>org.eclipse.opensmartclide.context.services.IAmIMonitoringService</proxy>
        </service>
        <service id="AmI-repository">
            <host>localhost</host>
            <location>http://localhost:19002</location>
            <name>AmIMonitoringDataRepositoryService</name>
            <server>org.eclipse.opensmartclide.context.services.AmIMonitoringDataRepositoryService</server>
            <proxy>org.eclipse.opensmartclide.context.services.IAmIMonitoringDataRepositoryService</proxy>
        </service>
        <service id="PersistenceUnitService">
            <host>localhost</host>
            <location>http://localhost:19004</location>
            <name>PersistenceUnitService</name>
            <server>org.eclipse.opensmartclide.context.services.PersistenceUnitService</server>
            <proxy>org.eclipse.opensmartclide.core.services.IPersistenceUnitService</proxy>
        </service>
    </services>
</config>
